[
  {"asset_id": "cftc_13874a_net_spec", "symbol": "13874A_SPEC", "name": "E-mini S&P 500 - Net Speculative", "category": "regulatory", "subcategory": "cot", "api_ref": "13874A:net_spec", "active": true},
  {"asset_id": "cftc_13874a_net_comm", "symbol": "13874A_COMM", "name": "E-mini S&P 500 - Net Commercial", "category": "regulatory", "subcategory": "cot", "api_ref": "13874A:net_comm", "active": true},
  {"asset_id": "cftc_209742_net_spec", "symbol": "209742_SPEC", "name": "E-mini Nasdaq 100 - Net Speculative", "category": "regulatory", "subcategory": "cot", "api_ref": "209742:net_spec", "active": true},
  {"asset_id": "cftc_209742_net_comm", "symbol": "209742_COMM", "name": "E-mini Nasdaq 100 - Net Commercial", "category": "regulatory", "subcategory": "cot", "api_ref": "209742:net_comm", "active": true},
  {"asset_id": "cftc_124603_net_spec", "symbol": "124603_SPEC", "name": "E-mini Dow Jones - Net Speculative", "category": "regulatory", "subcategory": "cot", "api_ref": "124603:net_spec", "active": true},
  {"asset_id": "cftc_124603_net_comm", "symbol": "124603_COMM", "name": "E-mini Dow Jones - Net Commercial", "category": "regulatory", "subcategory": "cot", "api_ref": "124603:net_comm", "active": true},
  {"asset_id": "cftc_1170e1_net_spec", "symbol": "1170E1_SPEC", "name": "VIX Futures - Net Speculative", "category": "regulatory", "subcategory": "cot", "api_ref": "1170E1:net_spec", "active": true},
  {"asset_id": "cftc_1170e1_net_comm", "symbol": "1170E1_COMM", "name": "VIX Futures - Net Commercial", "category": "regulatory", "subcategory": "cot", "api_ref": "1170E1:net_comm", "active": true},
  {"asset_id": "cftc_067651_net_spec", "symbol": "067651_SPEC", "name": "WTI Crude Oil - Net Speculative", "category": "regulatory", "subcategory": "cot", "api_ref": "067651:net_spec", "active": true},
  {"asset_id": "cftc_067651_net_comm", "symbol": "067651_COMM", "name": "WTI Crude Oil - Net Commercial", "category": "regulatory", "subcategory": "cot", "api_ref": "067651:net_comm", "active": true},
  {"asset_id": "cftc_023651_net_spec", "symbol": "023651_SPEC", "name": "Natural Gas - Net Speculative", "category": "regulatory", "subcategory": "cot", "api_ref": "023651:net_spec", "active": true},
  {"asset_id": "cftc_023651_net_comm", "symbol": "023651_COMM", "name": "Natural Gas - Net Commercial", "category": "regulatory", "subcategory": "cot", "api_ref": "023651:net_comm", "active": true},
  {"asset_id": "cftc_06765a_net_spec", "symbol": "06765A_SPEC", "name": "Brent Crude Oil - Net Speculative", "category": "regulatory", "subcategory": "cot", "api_ref": "06765A:net_spec", "active": true},
  {"asset_id": "cftc_06765a_net_comm", "symbol": "06765A_COMM", "name": "Brent Crude Oil - Net Commercial", "category": "regulatory", "subcategory": "cot", "api_ref": "06765A:net_comm", "active": true},
  {"asset_id": "cftc_088691_net_spec", "symbol": "088691_SPEC", "name": "Gold - Net Speculative", "category": "regulatory", "subcategory": "cot", "api_ref": "088691:net_spec", "active": true},
  {"asset_id": "cftc_088691_net_comm", "symbol": "088691_COMM", "name": "Gold - Net Commercial", "category": "regulatory", "subcategory": "cot", "api_ref": "088691:net_comm", "active": true},
  {"asset_id": "cftc_084691_net_spec", "symbol": "084691_SPEC", "name": "Silver - Net Speculative", "category": "regulatory", "subcategory": "cot", "api_ref": "084691:net_spec", "active": true},
  {"asset_id": "cftc_084691_net_comm", "symbol": "084691_COMM", "name": "Silver - Net Commercial", "category": "regulatory", "subcategory": "cot", "api_ref": "084691:net_comm", "active": true},
  {"asset_id": "cftc_085692_net_spec", "symbol": "085692_SPEC", "name": "Copper - Net Speculative", "category": "regulatory", "subcategory": "cot", "api_ref": "085692:net_spec", "active": true},
  {"asset_id": "cftc_085692_net_comm", "symbol": "085692_COMM", "name": "Copper - Net Commercial", "category": "regulatory", "subcategory": "cot", "api_ref": "085692:net_comm", "active": true},
  {"asset_id": "cftc_099741_net_spec", "symbol": "099741_SPEC", "name": "Euro FX - Net Speculative", "category": "regulatory", "subcategory": "cot", "api_ref": "099741:net_spec", "active": true},
  {"asset_id": "cftc_099741_net_comm", "symbol": "099741_COMM", "name": "Euro FX - Net Commercial", "category": "regulatory", "subcategory": "cot", "api_ref": "099741:net_comm", "active": true},
  {"asset_id": "cftc_096742_net_spec", "symbol": "096742_SPEC", "name": "Japanese Yen - Net Speculative", "category": "regulatory", "subcategory": "cot", "api_ref": "096742:net_spec", "active": true},
  {"asset_id": "cftc_096742_net_comm", "symbol": "096742_COMM", "name": "Japanese Yen - Net Commercial", "category": "regulatory", "subcategory": "cot", "api_ref": "096742:net_comm", "active": true},
  {"asset_id": "cftc_092741_net_spec", "symbol": "092741_SPEC", "name": "British Pound - Net Speculative", "category": "regulatory", "subcategory": "cot", "api_ref": "092741:net_spec", "active": true},
  {"asset_id": "cftc_092741_net_comm", "symbol": "092741_COMM", "name": "British Pound - Net Commercial", "category": "regulatory", "subcategory": "cot", "api_ref": "092741:net_comm", "active": true},
  {"asset_id": "cftc_090741_net_spec", "symbol": "090741_SPEC", "name": "Swiss Franc - Net Speculative", "category": "regulatory", "subcategory": "cot", "api_ref": "090741:net_spec", "active": true},
  {"asset_id": "cftc_090741_net_comm", "symbol": "090741_COMM", "name": "Swiss Franc - Net Commercial", "category": "regulatory", "subcategory": "cot", "api_ref": "090741:net_comm", "active": true},
  {"asset_id": "cftc_043602_net_spec", "symbol": "043602_SPEC", "name": "10-Year T-Note - Net Speculative", "category": "regulatory", "subcategory": "cot", "api_ref": "043602:net_spec", "active": true},
  {"asset_id": "cftc_043602_net_comm", "symbol": "043602_COMM", "name": "10-Year T-Note - Net Commercial", "category": "regulatory", "subcategory": "cot", "api_ref": "043602:net_comm", "active": true},
  {"asset_id": "cftc_042601_net_spec", "symbol": "042601_SPEC", "name": "2-Year T-Note - Net Speculative", "category": "regulatory", "subcategory": "cot", "api_ref": "042601:net_spec", "active": true},
  {"asset_id": "cftc_042601_net_comm", "symbol": "042601_COMM", "name": "2-Year T-Note - Net Commercial", "category": "regulatory", "subcategory": "cot", "api_ref": "042601:net_comm", "active": true},
  {"asset_id": "cftc_044601_net_spec", "symbol": "044601_SPEC", "name": "5-Year T-Note - Net Speculative", "category": "regulatory", "subcategory": "cot", "api_ref": "044601:net_spec", "active": true},
  {"asset_id": "cftc_044601_net_comm", "symbol": "044601_COMM", "name": "5-Year T-Note - Net Commercial", "category": "regulatory", "subcategory": "cot", "api_ref": "044601:net_comm", "active": true},
  {"asset_id": "cftc_020601_net_spec", "symbol": "020601_SPEC", "name": "30-Year T-Bond - Net Speculative", "category": "regulatory", "subcategory": "cot", "api_ref": "020601:net_spec", "active": true},
  {"asset_id": "cftc_020601_net_comm", "symbol": "020601_COMM", "name": "30-Year T-Bond - Net Commercial", "category": "regulatory", "subcategory": "cot", "api_ref": "020601:net_comm", "active": true},
  {"asset_id": "cftc_002602_net_spec", "symbol": "002602_SPEC", "name": "Corn - Net Speculative", "category": "regulatory", "subcategory": "cot", "api_ref": "002602:net_spec", "active": true},
  {"asset_id": "cftc_002602_net_comm", "symbol": "002602_COMM", "name": "Corn - Net Commercial", "category": "regulatory", "subcategory": "cot", "api_ref": "002602:net_comm", "active": true},
  {"asset_id": "cftc_005602_net_spec", "symbol": "005602_SPEC", "name": "Soybeans - Net Speculative", "category": "regulatory", "subcategory": "cot", "api_ref": "005602:net_spec", "active": true},
  {"asset_id": "cftc_005602_net_comm", "symbol": "005602_COMM", "name": "Soybeans - Net Commercial", "category": "regulatory", "subcategory": "cot", "api_ref": "005602:net_comm", "active": true},
  {"asset_id": "cftc_001602_net_spec", "symbol": "001602_SPEC", "name": "Wheat - Net Speculative", "category": "regulatory", "subcategory": "cot", "api_ref": "001602:net_spec", "active": true},
  {"asset_id": "cftc_001602_net_comm", "symbol": "001602_COMM", "name": "Wheat - Net Commercial", "category": "regulatory", "subcategory": "cot", "api_ref": "001602:net_comm", "active": true}
]
