[
  {"asset_id": "chris_es", "symbol": "CME_ES1", "name": "S&P 500 E-mini", "category": "commodities", "subcategory": "indices", "api_ref": "CME_ES1", "active": true},
  {"asset_id": "chris_nq", "symbol": "CME_NQ1", "name": "Nasdaq 100 E-mini", "category": "commodities", "subcategory": "indices", "api_ref": "CME_NQ1", "active": true},
  {"asset_id": "chris_ym", "symbol": "CME_YM1", "name": "Dow Jones E-mini", "category": "commodities", "subcategory": "indices", "api_ref": "CME_YM1", "active": true},
  {"asset_id": "chris_rty", "symbol": "CME_RTY1", "name": "Russell 2000 E-mini", "category": "commodities", "subcategory": "indices", "api_ref": "CME_RTY1", "active": true},
  {"asset_id": "chris_fesx", "symbol": "EUREX_FESX1", "name": "Euro Stoxx 50", "category": "commodities", "subcategory": "indices", "api_ref": "EUREX_FESX1", "active": true},
  {"asset_id": "chris_fdax", "symbol": "EUREX_FDAX1", "name": "DAX", "category": "commodities", "subcategory": "indices", "api_ref": "EUREX_FDAX1", "active": true},
  {"asset_id": "chris_cl", "symbol": "CME_CL1", "name": "WTI Crude Oil", "category": "commodities", "subcategory": "energy", "api_ref": "CME_CL1", "active": true},
  {"asset_id": "chris_ng", "symbol": "CME_NG1", "name": "Natural Gas", "category": "commodities", "subcategory": "energy", "api_ref": "CME_NG1", "active": true},
  {"asset_id": "chris_rb", "symbol": "CME_RB1", "name": "RBOB Gasoline", "category": "commodities", "subcategory": "energy", "api_ref": "CME_RB1", "active": true},
  {"asset_id": "chris_ho", "symbol": "CME_HO1", "name": "Heating Oil", "category": "commodities", "subcategory": "energy", "api_ref": "CME_HO1", "active": true},
  {"asset_id": "chris_brent", "symbol": "ICE_B1", "name": "Brent Crude Oil", "category": "commodities", "subcategory": "energy", "api_ref": "ICE_B1", "active": true},
  {"asset_id": "chris_gc", "symbol": "CME_GC1", "name": "Gold", "category": "commodities", "subcategory": "metals", "api_ref": "CME_GC1", "active": true},
  {"asset_id": "chris_si", "symbol": "CME_SI1", "name": "Silver", "category": "commodities", "subcategory": "metals", "api_ref": "CME_SI1", "active": true},
  {"asset_id": "chris_hg", "symbol": "CME_HG1", "name": "Copper", "category": "commodities", "subcategory": "metals", "api_ref": "CME_HG1", "active": true},
  {"asset_id": "chris_pl", "symbol": "CME_PL1", "name": "Platinum", "category": "commodities", "subcategory": "metals", "api_ref": "CME_PL1", "active": true},
  {"asset_id": "chris_pa", "symbol": "CME_PA1", "name": "Palladium", "category": "commodities", "subcategory": "metals", "api_ref": "CME_PA1", "active": true},
  {"asset_id": "chris_zc", "symbol": "CBOT_ZC1", "name": "Corn", "category": "commodities", "subcategory": "agriculture", "api_ref": "CBOT_ZC1", "active": true},
  {"asset_id": "chris_zs", "symbol": "CBOT_ZS1", "name": "Soybeans", "category": "commodities", "subcategory": "agriculture", "api_ref": "CBOT_ZS1", "active": true},
  {"asset_id": "chris_zw", "symbol": "CBOT_ZW1", "name": "Wheat", "category": "commodities", "subcategory": "agriculture", "api_ref": "CBOT_ZW1", "active": true},
  {"asset_id": "chris_zm", "symbol": "CBOT_ZM1", "name": "Soybean Meal", "category": "commodities", "subcategory": "agriculture", "api_ref": "CBOT_ZM1", "active": true},
  {"asset_id": "chris_zl", "symbol": "CBOT_ZL1", "name": "Soybean Oil", "category": "commodities", "subcategory": "agriculture", "api_ref": "CBOT_ZL1", "active": true},
  {"asset_id": "chris_kc", "symbol": "ICE_KC1", "name": "Coffee", "category": "commodities", "subcategory": "agriculture", "api_ref": "ICE_KC1", "active": true},
  {"asset_id": "chris_sb", "symbol": "ICE_SB1", "name": "Sugar #11", "category": "commodities", "subcategory": "agriculture", "api_ref": "ICE_SB1", "active": true},
  {"asset_id": "chris_cc", "symbol": "ICE_CC1", "name": "Cocoa", "category": "commodities", "subcategory": "agriculture", "api_ref": "ICE_CC1", "active": true},
  {"asset_id": "chris_ct", "symbol": "ICE_CT1", "name": "Cotton", "category": "commodities", "subcategory": "agriculture", "api_ref": "ICE_CT1", "active": true},
  {"asset_id": "chris_le", "symbol": "CME_LE1", "name": "Live Cattle", "category": "commodities", "subcategory": "agriculture", "api_ref": "CME_LE1", "active": true},
  {"asset_id": "chris_he", "symbol": "CME_HE1", "name": "Lean Hogs", "category": "commodities", "subcategory": "agriculture", "api_ref": "CME_HE1", "active": true},
  {"asset_id": "chris_zb", "symbol": "CBOT_ZB1", "name": "30-Year T-Bond", "category": "commodities", "subcategory": "rates", "api_ref": "CBOT_ZB1", "active": true},
  {"asset_id": "chris_zn", "symbol": "CBOT_ZN1", "name": "10-Year T-Note", "category": "commodities", "subcategory": "rates", "api_ref": "CBOT_ZN1", "active": true},
  {"asset_id": "chris_zf", "symbol": "CBOT_ZF1", "name": "5-Year T-Note", "category": "commodities", "subcategory": "rates", "api_ref": "CBOT_ZF1", "active": true},
  {"asset_id": "chris_zt", "symbol": "CBOT_ZT1", "name": "2-Year T-Note", "category": "commodities", "subcategory": "rates", "api_ref": "CBOT_ZT1", "active": true},
  {"asset_id": "chris_ge", "symbol": "CME_GE1", "name": "Eurodollar", "category": "commodities", "subcategory": "rates", "api_ref": "CME_GE1", "active": true},
  {"asset_id": "chris_bund", "symbol": "EUREX_FGBL1", "name": "Euro Bund", "category": "commodities", "subcategory": "rates", "api_ref": "EUREX_FGBL1", "active": true},
  {"asset_id": "chris_ec", "symbol": "CME_EC1", "name": "Euro FX", "category": "commodities", "subcategory": "currencies", "api_ref": "CME_EC1", "active": true},
  {"asset_id": "chris_jy", "symbol": "CME_JY1", "name": "Japanese Yen", "category": "commodities", "subcategory": "currencies", "api_ref": "CME_JY1", "active": true},
  {"asset_id": "chris_bp", "symbol": "CME_BP1", "name": "British Pound", "category": "commodities", "subcategory": "currencies", "api_ref": "CME_BP1", "active": true},
  {"asset_id": "chris_sf", "symbol": "CME_SF1", "name": "Swiss Franc", "category": "commodities", "subcategory": "currencies", "api_ref": "CME_SF1", "active": true},
  {"asset_id": "chris_cd", "symbol": "CME_CD1", "name": "Canadian Dollar", "category": "commodities", "subcategory": "currencies", "api_ref": "CME_CD1", "active": true},
  {"asset_id": "chris_ad", "symbol": "CME_AD1", "name": "Australian Dollar", "category": "commodities", "subcategory": "currencies", "api_ref": "CME_AD1", "active": true},
  {"asset_id": "chris_dx", "symbol": "ICE_DX1", "name": "US Dollar Index", "category": "commodities", "subcategory": "currencies", "api_ref": "ICE_DX1", "active": true},
  {"asset_id": "chris_vx", "symbol": "CBOE_VX1", "name": "VIX Futures", "category": "commodities", "subcategory": "volatility", "api_ref": "CBOE_VX1", "active": true},
  {"asset_id": "chris_niy", "symbol": "CME_NIY1", "name": "Nikkei 225 (Yen)", "category": "commodities", "subcategory": "indices", "api_ref": "CME_NIY1", "active": true},
  {"asset_id": "chris_nk", "symbol": "SGX_NK1", "name": "Nikkei 225 (SGX)", "category": "commodities", "subcategory": "indices", "api_ref": "SGX_NK1", "active": true},
  {"asset_id": "chris_hsi", "symbol": "HKEX_HSI1", "name": "Hang Seng Index", "category": "commodities", "subcategory": "indices", "api_ref": "HKEX_HSI1", "active": true},
  {"asset_id": "chris_nz", "symbol": "CME_NZ1", "name": "New Zealand Dollar", "category": "commodities", "subcategory": "currencies", "api_ref": "CME_NZ1", "active": true},
  {"asset_id": "chris_mp", "symbol": "CME_MP1", "name": "Mexican Peso", "category": "commodities", "subcategory": "currencies", "api_ref": "CME_MP1", "active": true},
  {"asset_id": "chris_br", "symbol": "CME_BR1", "name": "Brazilian Real", "category": "commodities", "subcategory": "currencies", "api_ref": "CME_BR1", "active": true},
  {"asset_id": "chris_ru", "symbol": "CME_RU1", "name": "Russian Ruble", "category": "commodities", "subcategory": "currencies", "api_ref": "CME_RU1", "active": true},
  {"asset_id": "chris_zo", "symbol": "CBOT_ZO1", "name": "Oats", "category": "commodities", "subcategory": "agriculture", "api_ref": "CBOT_ZO1", "active": true},
  {"asset_id": "chris_zr", "symbol": "CBOT_ZR1", "name": "Rough Rice", "category": "commodities", "subcategory": "agriculture", "api_ref": "CBOT_ZR1", "active": true}
]
